{
  "schemaVersion": 1,
  "routingVersion": "v1.0.0",
  "unmatched": {
    "profileId": "delivery-change",
    "requiresAnalysis": true,
    "reason": "改动对象未在表内声明时按最重档处理：分类不出来就说明还没想清楚要动什么，此时省掉分析线的代价远大于多跑一次的成本。第一次误挡的处置方式是调这张表，不是关门。"
  },
  "routes": [
    {
      "changeObject": "governance-contract",
      "displayName": "治理合同",
      "description": "改动交付流水线自身的约束：openspec/contracts/**、openspec/schemas/**、openspec/profiles/**、AGENTS.md 的硬规则、命令源与站位定义。",
      "profileId": "delivery-change",
      "requiresAnalysis": true,
      "reason": "治理合同是所有后续改动的判据来源，改错一次会让此后每一单都建立在错的门禁上，必须先把问题和候选摊开再动手。"
    },
    {
      "changeObject": "tool-code",
      "displayName": "工具代码",
      "description": "改动 openspec/tools/** 的可执行行为与其配套 test/** 断言。",
      "profileId": "delivery-change",
      "requiresAnalysis": true,
      "reason": "工具代码是门禁的执行体，行为改动会直接放宽或收紧真门禁，需要完整的方案与验收链留痕。"
    },
    {
      "changeObject": "doc-expression",
      "displayName": "文档表达",
      "description": "只改说明面的措辞、结构与示例：docs/**、README.md，且不改变任何机器可读的约束。",
      "profileId": "light-change",
      "requiresAnalysis": false,
      "reason": "说明面改错的代价是读者困惑，可以在下一次阅读时随手纠正；为它跑一遍分析线属于把仪式成本加在零风险改动上。豁免的前提是确实不碰机器可读约束——一旦顺手改了合同或代码，改动对象就不再是 doc-expression。"
    },
    {
      "changeObject": "ledger-only",
      "displayName": "纯台账",
      "description": "只在 openspec/intake/** 内增删改条目本身，不产生任何 Change 目录与代码改动。",
      "profileId": "light-change",
      "requiresAnalysis": false,
      "reason": "台账条目就是分析线的输入，要求它先跑一遍分析线会形成自指循环；条目写错的代价只是台账不整洁，可直接改。"
    }
  ]
}
